{
  "metadata":{"schema_version":"1","artifact_id":"world-index:arcana-sa002","revision":"wi:sa002:1","spec_version":"1.0.0-rc.1","content_hash":{"scope":"artifact-content","status":"unresolved","reason":"Generic artifact canonical bytes and digest algorithm remain unresolved."},"provenance":{"source_kind":"experimental-fixture","source_id":"SUCCESS-ARCANA-002","source_revision":"1","created_at":"2026-01-01T00:00:00Z"},"compatibility":{"domain":"WorldIndex","contract_revision":"1","declarations":{"experimental":true}}},
  "index_schema_revision":"1","world_index_revision":"wi:sa002:1","source_world_revision":"world:sa002:1","snapshot":{"world_index_revision":"wi:sa002:1","source_world_revision":"world:sa002:1","captured_at":"2026-01-01T00:00:00Z","index_schema_revision":"1"},
  "records":[
    {"entity_id":"entity:sa002:patient","type_tags":["Organism"],"symbolic_names":["patient:sa002"],"spatial_summary":{"region":"clinic:sa002"},"relation_keys":["correspondence:sa002:red-thread"],"visibility_metadata":{"discoverability_class":"private-medical","redaction_policy":"medical"},"record_revision":"record:sa002:patient:1","source_world_revision":"world:sa002:1"},
    {"entity_id":"entity:sa002:proxy","type_tags":["TreatmentProxy"],"symbolic_names":["proxy:sa002"],"spatial_summary":{"region":"clinic:sa002"},"relation_keys":["correspondence:sa002:red-thread"],"visibility_metadata":{"discoverability_class":"private-medical","redaction_policy":"medical"},"record_revision":"record:sa002:proxy:1","source_world_revision":"world:sa002:1"},
    {"entity_id":"entity:sa002:donor","type_tags":["MatterSource"],"symbolic_names":["donor:sa002"],"spatial_summary":{"region":"clinic:sa002"},"relation_keys":[],"visibility_metadata":{"discoverability_class":"private-medical","redaction_policy":"medical"},"record_revision":"record:sa002:donor:1","source_world_revision":"world:sa002:1"}
  ],
  "indexes":{"identity":{"entity:sa002:patient":0,"entity:sa002:proxy":1,"entity:sa002:donor":2},"symbolic":{"patient:sa002":["entity:sa002:patient"],"proxy:sa002":["entity:sa002:proxy"],"donor:sa002":["entity:sa002:donor"]},"spatial":{"clinic:sa002":["entity:sa002:patient","entity:sa002:proxy","entity:sa002:donor"]},"relation":{"correspondence:sa002:red-thread":["entity:sa002:patient","entity:sa002:proxy"]},"visibility":{"private-medical":["entity:sa002:patient","entity:sa002:proxy","entity:sa002:donor"]}}
}
