{
  "metadata":{"schema_version":"1","artifact_id":"world-index:arcana-sa003","revision":"wi:sa003:1","spec_version":"1.0.0-rc.1","content_hash":{"scope":"artifact-content","status":"unresolved","reason":"Generic artifact canonical bytes and digest algorithm remain unresolved."},"provenance":{"source_kind":"experimental-fixture","source_id":"SUCCESS-ARCANA-003","source_revision":"1","created_at":"2026-01-01T00:00:00Z"},"compatibility":{"domain":"WorldIndex","contract_revision":"1","declarations":{"experimental":true}}},
  "index_schema_revision":"1","world_index_revision":"wi:sa003:1","source_world_revision":"world:sa003:7","snapshot":{"world_index_revision":"wi:sa003:1","source_world_revision":"world:sa003:7","captured_at":"2026-01-01T00:00:00Z","index_schema_revision":"1"},
  "records":[{"entity_id":"entity:sa003:subject","type_tags":["HistoricalSubject"],"symbolic_names":["subject:sa003"],"spatial_summary":{"region":"archive:sa003"},"relation_keys":["evidence-subject:sa003"],"visibility_metadata":{"discoverability_class":"restricted","required_discovery_context":"capability:sa003:discovery","redaction_policy":"history-privacy"},"record_revision":"record:sa003:subject:7","source_world_revision":"world:sa003:7"}],
  "indexes":{"identity":{"entity:sa003:subject":0},"symbolic":{"subject:sa003":["entity:sa003:subject"]},"spatial":{"archive:sa003":["entity:sa003:subject"]},"relation":{"evidence-subject:sa003":["entity:sa003:subject"]},"visibility":{"restricted":["entity:sa003:subject"]}}
}
